{
    "verse": "ब्रह्मानन्दो भवेदेष चेत्परार्धगुणीकृतः । नैति भक्तिसुखाम्भोधेः परमाणुतुलामपि ॥ (भ.र.सि. १-२१)",
    "terms": {
        "ब्रह्मानन्दः": "The bliss of Brahman",
        "भवेत्": "becomes",
        "एषः": "this",
        "चेत्": "if",
        "परार्धगुणीकृतः": "intensified by infinite degrees",
        "न एति": "cannot be compared",
        "भक्तिसुखाम्भोधेः": "to the bliss of devotion and knowledge",
        "परमाणुतुलाम् अपि": "even to the tiniest particle"
    },
    "meaning": "अरबो गुना करो ब्रह्मानंद में तो भी प्रेमानंद के बिंदु के बराबर भी नहीं हो सकता । इसलिए ब्रह्मानंदी प्रेमानंद को पाकर बरबस भूल जाता है, If the bliss of Brahman is intensified by infinite degrees, it still cannot be compared to the bliss of devotion and knowledge, not even to the tiniest particle.It highlights the incomparable nature of the bliss experienced through devotion and knowledge compared to the bliss of Brahman. It says that even if the bliss of Brahman is intensified infinitely, it still cannot match the bliss experienced through devotion and knowledge. The verse emphasizes the superiority of the bliss derived from spiritual practices and understanding over the bliss of Brahman alone."
}