{
    "verse_no": "२-४",
    "verse": "यतो वाचो निवर्तन्ते। अप्राप्य मनसा सह। आनन्दं ब्रह्मणो विद्वान्‌। न बिभेति कदाचनेति। तस्यैष एव शारीर आत्मा। यः पूर्वस्य।\nतस्माद्वा एतस्मान्मनोमयात्‌। अन्योऽन्तर आत्मा विज्ञानमयः।तेनैष पूर्णः। स वा एष पुरुषविध एव।तस्य पुरुषविधताम्। अन्वयं पुरुषविधः। तस्य श्रद्धैव शिरः।ऋतं दक्षिणः पक्षः।सत्यमुत्तरः पक्षः। योग आत्मा। महः पुच्छं प्रतिष्ठा।तदप्येष श्लोको भवति॥",
    "terms": {
        "यतः": "from where",
        "वाचः": "speech",
        "निवर्तन्ते": "return, retreat",
        "अप्राप्य": "not obtaining",
        "मनसा": "by the mind",
        "सह": "along with",
        "आनन्दं": "joy, bliss",
        "ब्रह्मणः": "of the Supreme Being",
        "विद्वान्‌": "the knower",
        "न": "not",
        "बिभेति": "fears",
        "कदाचना": "at any time",
        "इति": "thus",
        "तस्य": "his",
        "एषः": "this",
        "एव": "indeed",
        "शारीरः": "body",
        "आत्मा": "self",
        "यः": "who",
        "पूर्वस्य": "of the previous (births)",
        "तस्मात्‌": "therefore",
        "वा": "or",
        "एतस्मान्‌": "from this",
        "मनोमयात्‌": "consisting of the mind",
        "अन्यः": "other",
        "अन्तः": "inner",
        "विज्ञानमयः": "composed of knowledge",
        "तेन": "by that",
        "पूर्णः": "complete, fulfilled",
        "सः": "he",
        "पुरुषविधः": "knower of the person (self)",
        "पुरुषविधताम्‌": "being the knower of the person (self)",
        "अन्वयं": "connection",
        "श्रद्धा": "faith, devotion",
        "शिरः": "head",
        "ऋतं": "truth",
        "दक्षिणः": "right",
        "पक्षः": "wing",
        "सत्यम्‌": "truth",
        "उत्तरः": "north or upper",
        "योगः": "union, connection",
        "महः": "mind",
        "पुच्छम्‌": "tail",
        "प्रतिष्ठा": "support, base",
        "तत्‌": "that",
        "अपि": "also",
        "श्लोकः": "verse",
        "भवति": "becomes"
    },
    "meaning": "Meaning:From where speech retreats along with the mind without attaining Bliss of Brahman (the Supreme Being), the knower of Brahman does not fear at any time. This very body is the soul, which belonged to the previous (birth). Therefore, from this (body) the other inner self, consisting of the mind, is the knower of the self composed of knowledge. By that (knowledge), this (person) is fulfilled. He (the knower) indeed is the knower of the self. His connection (with the self) is the knower of the person (self). His faith is the head. Truth is the right wing. Truth is the north or upper wing. The union with self is the mind. The tail is the support or basis. Even this verse becomes the same."
}