{
    "verse_no": "२-५",
    "verse": "विज्ञानं यज्ञं तनुते। कर्माणि तनुतेऽपि च।विज्ञानं देवाः सर्वे।ब्रह्म ज्येष्ठमुपासते। विज्ञानं ब्रह्म चेद्वेद।तस्माच्चेन्न प्रमाद्यति। शरीरे पाप्मनो हित्वा।सर्वान् कामान् समश्नुत इति। तस्यैष एव शारीर आत्मा।यः पूर्वस्य।\nतस्माद्वा एतस्माद्विज्ञानमयात्। अन्योऽन्तर आत्माऽऽनन्दमयः तेनैष पूर्णः।स वा एष पुरुषविध एव। तस्य पुरुषविधताम्। अन्वयं पुरुषविधः। तस्य प्रियमेव शिरः। मोदो दक्षिणः पक्षः।प्रमोद उत्तरः पक्षः। आनन्द आत्मा। ब्रह्म पुच्छं प्रतिष्ठा।तदप्येष श्लोको भवति॥",
    "terms": {
        "विज्ञानं": "knowledge",
        "यज्ञं": "sacrifice",
        "तनुते": "produces",
        "कर्माणि": "actions/work",
        "अपि": "also",
        "च": "and",
        "देवाः": "gods",
        "सर्वे": "all",
        "ब्रह्म": "Brahman",
        "ज्येष्ठम्": "higher",
        "उपासते": "worship",
        "चेद्वेद": "knows",
        "तस्मात्": "therefore",
        "चेन्न": "not",
        "प्रमाद्यति": "errs",
        "शरीरे": "in the body",
        "पाप्मनो": "sinful/desired",
        "हित्वा": "abandoning",
        "सर्वान्": "all",
        "कामान्": "desires",
        "समश्नुते": "obtains",
        "इति": "thus",
        "तस्य": "his",
        "एष": "this",
        "एव": "indeed",
        "शारीर": "body",
        "आत्मा": "soul",
        "यः": "who",
        "पूर्वस्य": "previously/existing before",
        "तस्माद्": "therefore",
        "वा": "indeed",
        "एतस्माद्": "from this",
        "विज्ञानमयात्": "from knowledge",
        "अन्योऽन्तर्": "another different",
        "आनन्दमयः": "full of bliss",
        "तेन": "by that",
        "पूर्णः": "complete",
        "स": "he",
        "पुरुषविध": "a description of a person",
        "पुरुषविधताम्": "the nature of a person",
        "अन्वयं": "orderly",
        "पुरुषविधः": "a description of a person",
        "प्रियम्": "dear",
        "शिरः": "head",
        "मोदः": "pleasure",
        "दक्षिणः": "right",
        "पक्षः": "side",
        "प्रमोदः": "great pleasure/jubilation",
        "उत्तरः": "left",
        "आनन्द": "bliss",
        "पुच्छं": "tail",
        "प्रतिष्ठा": "support/foundation",
        "तदपि": "yet",
        "श्लोकः": "verse",
        "भवति": "is"
    },
    "meaning": "Meaning:Knowledge produces sacrifice. And actions also produce it. All gods worship the higher knowledge. Brahman is worshipped as the highest. If one knows knowledge, then one does not err. In the body, abandoning desires that lead to sin, one attains all desires. This very body is the soul which existed before.Therefore, indeed, from this knowledge arises another different soul, full of bliss. That soul is complete through that. He indeed is the description of a person. His nature is an orderly description of a person. The head is dear to him. Pleasure is on the right side. Great pleasure is on the left side. The soul is bliss. Brahman is the support/foundation. That verse also happens."
}