{
    "verse": "मीनाः स्नानपराः फणी पवनभुङ्मेषश्च पर्णाशनो \\nनिराश:खलु चातको हि नितरां शेते बिले मूषकः । \\nभस्मोध्द्वलन तत्परश्च हि खरो ध्यानाधिसरो बकस  \\nते सर्वे न हि यान्ति मोक्षपदवीं भक्तिं बिना श्री हरे:॥",
    "terms": {
        "मीनाः": "fishes",
        "स्नानपराः": "fond of bathing",
        "फणी": "serpents",
        "पवनभुङ्मेषः": "dig up the earth",
        "च": "and",
        "पर्णाशनः": "feed on leaves",
        "निराश:": "without hope",
        "खलु": "indeed",
        "चातकः": "the chataka bird",
        "हि": "indeed",
        "नितरां": "always",
        "शेते": "lies",
        "बिले": "in a hole",
        "मूषकः": "mouse",
        "भस्मोध्द्वलन": "firefly",
        "तत्परः": "focused on",
        "खरः": "ass",
        "ध्यानाधिसरः": "dedicated to meditation",
        "बकः": "heron",
        "ते": "those",
        "सर्वे": "all",
        "न": "not",
        "यान्ति": "attain",
        "मोक्षपदवीं": "the abode of liberation",
        "भक्तिं": "devotion",
        "बिना": "without",
        "श्री हरे:": "Lord Hari (Vishnu)",
        "Word": "by-word breakdown of the meaning:",
        "निराशः": "without hope"
    },
    "meaning": "Meaning: Fishes and serpents are fond of bathing and digging up the earth, while they feed on leaves.Meaning: The chataka bird, always without hope, lies in a hole like a mouse.Meaning: The firefly is focused on ashes, while the ass is dedicated to meditation, and the heron.Meaning: All of them do not attain the abode of liberation without devotion to Lord Hari.Overall meaning: Fishes and serpents exhibit their natural behavior, while the chataka bird, firefly, ass, and heron engage in futile pursuits without achieving liberation. One can only attain the abode of liberation by cultivating devotion to Lord Hari."
}